Participant,File,Utterance #,Transcript,Coding
EAR_20.xlsx,200,,but like* can you just imagine if like* little like* neon creatures like* get used to it like* that so they like* and make like* anime noises in the dark but like* wouldn't that be funny if like* you actually like* went out into the woods and like* put some like* little creatures in the balls and then like* gave them to you and like* you like* take care of them you have like* a pen ,
EAR_20.xlsx,202,,not don't try it again oh no i know i know i know but it like* my mom's like* you need to get that fixed and im like* ,
EAR_20.xlsx,203,,but also just like* i don't know why i don't like* it's i don't know like* oh sorry there's a hair in my mouth the whole like* oh i have d boobies i have c boobies cuz like* it's so like* a twenty-eight like* d and like* a forty d are completely different sizes so like* honestly like* i would not i don't say i mean i don't even have a classification for my own boobs cuz i can wear different size bras and they fit different thirty-four d thirty-six c ,
EAR_20.xlsx,204,,i have too i have the same round shape as kim k no excuse me you can look at their measurements and you can measure around my ass and you'll be like* oh she was right she has the same size butt as she has this i have the same size booty as her but she's short and she has a smaller waist than me but it's like* it's big i don't even know how i don't know my measurements i mean i think i'm a little different i don't know them off the top of my head i think yours is like* super wide ,
EAR_20.xlsx,205,,swallow at all it's cuz guys like it it doesn't taste good i mean i prefer that yeah too bad i just like to do it to make them feel good usually usually it's like* you switch to sex i don't know i haven't like* i don't know i don't know i think it depends from guy to guy it really does depends from guy to guy because like* ,
EAR_20.xlsx,206,,no you would be surprised some small looking guys taste like* oh and also like* i can't even wrap my hand around it mhm it depends on cuz like* like* i don't know i always like whenever i wanna pick up guys like* i always start with the that's how i like* open up ,
EAR_20.xlsx,207,,that's an expression that's a real expression yeah that's a real expression that's a real ass expression it's really sometimes like* someone can like* just say a word and then we'll be like* oh my god this thing happened you know so like* i saw that and then i was like* oh i do remember it he was hitting me so hard and i was literally like* ow and then he stopped cuz i was like* ow that's too hard oh i was like* way to ruin the mood i do not like that i think that i think he did it like* three more times ,
EAR_20.xlsx,208,,yo the amas are on it's actually like* such like* i put a lot of effort into myself so like* no they're good they're really good i take good selfies but like* i put effort into it yo ai had a fire alarm thank god i wasn't there ,
EAR_20.xlsx,209,,because i don't know i'm just not a sorority girl but i love partying so yeah yeah because i always but i don't want to pay that much but like* cuz i've always grown up like* with soccer so i was always on a team and i always had that bond wait what like* right now wait yes no wait wait wait ,
EAR_20.xlsx,219,,nine o'clock don't assume anything okay he's probably really just studying you guys have been hanging out what every day so like* no time for homework so he's just catching up right now don't assume anything it's okay he might cuz like* okay when i'm doing homework i ignore all my friends wait are you serious okay you need to tell me exactly what happened so you said ,
EAR_20.xlsx,252,,double chocolate chip i've never seen it i have never heard of that we're gonna get a house oh my god hell yeah and it's cheaper yeah thank you so much because i wanted to do glen mor but it's just so much money and i didn't want to ask my parents and like* yo drop that thousand five hundred dollars a month ,
EAR_20.xlsx,269,,oh because like* i honestly do you want one i honestly can't remember seeing hm hold on woah mm ,
EAR_20.xlsx,292,,mhm i love it uhuh uhuh aw that's so nice no freaking way then someone could like* steal your identity you're like* damn ,
EAR_20.xlsx,297,,maybe you're like* where it could possibly be because we checked the parking spot we checked the bathroom it's not where we're sitting it's not no but i'm pretty sure she did not put it in here yeah she did not put it in here and then i can't remember all i know is that we went to burger you had it you bought boba here you had it we were sitting down i'm pretty sure you had it i know you didn't toss it are you sure you didn't toss it in the trash oh my god yeah go ask wait but then i feel like if we ask him do you think he might start looking for it and if he finds it he might take it ,
EAR_064.xlsx,2,,it was okay yeah not bad _ they gave me this fucking _ listening device so like* for the next four days until i meet with them on tuesday again my conversations could be recorded yeah ,
EAR_064.xlsx,14,,oh pretty sure that was a little racist but know who am i to judge i gotta keep this recorder on me at all times yeah um they don't well she didn't uh she didn't tell me she's like* ah i won't tell you at at the end cuz it's like* she wants to be just natural and authentic just like* me doing my everyday life yeah ,
EAR_064.xlsx,24,,hey why oh you don't but why yeah man because like* yo what's up bro you took notes like* they answer based on what they took notes on so like* ,
EAR_064.xlsx,43,,but it's on that side of the street it's like* all the way back there look straight up there like* five cars oh yeah there are some spots where it's not green who the fuck gets intimidated by you darren's fuckin using echolocation ,
EAR_064.xlsx,47,,ah okay then fucking imma get my car then and then i'll i'll meet you guys at the roundabout if you guys like* like* just use my wallet to just like* scan that shit and then the code is eight eight oh five and just um grab me a jacket on your way out yeah yeah ,
EAR_064.xlsx,49,,fuck this place it's like* please see attendant sometimes i wish i lived in like* the fucking sixties and seventies where gas was like* ten cents ,
EAR_064.xlsx,51,,the reason why i fuckin cough is like* i just felt it all in my fuckin nose _ you know when you like* drink soda and you burp and that shit just like* you just feel it in your nose that's what i felt it yeah it just fuckin burned bro and then i just like* got a cough dude the only accident when i swallowed water at the beach and you can just feel it in your fucking nose from all the salt water and shit that's genuinely how i felt what i felt ,
EAR_064.xlsx,55,,no it could be recording right now right now it could be recording our conversation shut your ass up you ain't doing shit so stupid so stupid yes it is i swear to god yeah it just comes and goes like* you don't know when it's recording or when it is oh my god you fuckin bitch ,
EAR_064.xlsx,56,,okay anyways i'm just like* why does it matter like* cuz i thought cuz i thought cuz i though fuckin like* she's bored or whatever right she's like* what the fuck what's cuz you talk so much shit i'm like* yeah i just say she's being annoying yeah i'm just like* if you're bored but the way i meant it is like* it would be weird if i had leila just come through and darrien's not there darrien's at home ya know like* let's say leila did decide to stay for the weekend and i'm like* come hang out with me right with my family right so i get i get ,
EAR_064.xlsx,60,,bro can you imagine like* you're a fucking regular chemistry teacher and you make the fucking purest form of meth alright guys the traffic is yeah it's like* i'm one of you guys ,
EAR_064.xlsx,62,,in here right we came here bro to check this place out bro look at this shit this is fuckin like* no right here look at this shit biggest fuckin dump literally like* fucking ted bundy killed fuckin women in there it's fuckin garbage they the way they boasted about that shit on craiglist for having that shit like* i was boggled bro i was fuckin they did and it's like* oh we have we have two refrigerators you know for for four people like* trust bro we go in there bro the fuckin refrigerators are all stained with like* food and shit whatever like* that it's all clustered how and like* random like* dressers and closets and shit like* just like* furniture like* the worst furniture ,
EAR_064.xlsx,63,,five fifteen but i had to like* pay the rest of it with my card yeah well it's a wrap now no definitely not definitely not not in the ,
EAR_064.xlsx,75,,fuck stop it i've had enough yeah what the fuck is on my eyelash it's like* fucking like* some kind of bug it's a water bro ,
EAR_064.xlsx,94,,bro fuckin uh i had her friends on my page so then i and then she's like* shit can we do can we do monday and i'm like* nah tuesday so she's gonna meet us on tuesday or meet me on tuesday yeah yeah the inside of the car oh okay ,
EAR_064.xlsx,101,,listen you don't understand i've never seen a man on like* so focused on like* completely like* already got the fuck up he's done he he even said he he got up is like* listen you know what oh we're still ordering food like* ,
EAR_064.xlsx,102,,yeah okay uh okay alright okay okay i'll tell him i'll go back to him they messed up a little bit there i'm like* i don't know why you do retarded you didn't pick up in the first place why didn't you just pick up ,
EAR_064.xlsx,119,,yeah bro you said you're from ucla like* that's your school i like that ,
EAR_064.xlsx,130,,listen what happened to fuckin wingstop what happened to that right we can kick it during that time maybe smoke a little more and then go get it it's parked like* i don't mind driving is the thing but it's like* ,
EAR_064.xlsx,148,,yeah no it wasn't like* a regular house yeah it was like* it was one of those it was one of those no ragdolls are like* close to like* seven eight-hundred like* close to a grand no it was ,
EAR_064.xlsx,153,,anyways _ anyways really tired i mean like* i don't know ,
EAR_064.xlsx,193,,oh my god _ ok go go to the itunes r app store whatever app store whatever go okay app store xrr and then do you see like* the top right there should be a button top right ,
EAR_064.xlsx,302,,yeah but like* i want people to actually drink drink not like* bitching out like* oh my god i don't wanna fuckin drink ya know okay uh yeah jordan for one but he's gonna change he's gonna change alright pop let's go let's go no no i don't know i don't maybe i will but if i not ,
EAR_072.xlsx,57,,i know that like* waking up early and exercising that's supposed to be like* empowering_oh my god_oh i get it royal tea ,
EAR_072.xlsx,123,,so this this it's supposed to tell you your body like* just do the outline of your body ,
EAR_072.xlsx,186,,ugh the bag even smells like it like* the like* the scent of ,
EAR_072.xlsx,189,,how is it when i need fucking specific motherfucking tape it just decides nah bitch i'm not existing where's the one sided tape_ oh my god it's over here i was about to say it heard me talk smack and now it's like* no bitch ,
EAR_072.xlsx,210,,and i was like* ,
EAR_072.xlsx,248,,i remember when i could've gotten two two and now but then i would have been like* but then again i don't like salvi's so don't get too something that i don't like if i got barbaric barbarian i would have thought ,
EAR_072.xlsx,280,,ok bye it's like* i did it i ruined it ,
EAR_052.xlsx,1,,it's for a uh research lab for psych yeah but it doesn't record like* twenty-four seven it records like* in forty second intervals yeah for four days no your privacy is is uh hidden bruh _ why did you wanna be incriminated for something we got a funny guy here ,
EAR_052.xlsx,85,,like* if we pull up like* we would have to do something like* drink or smoke or like* play something it would be boring you know if we pulled up just to smoke and that's it yeah so i don't know what we could do _ like* i forgot how did they get put um that there was a threat sent out to hank or some shit oh ,
EAR_052.xlsx,142,,that's the fool that um uh i'm not i don't oh fuck um that's the foo i don't know if jesse went on a mission with him or not uh not with that uh asian guy with mike but mike pulled up to this office there were some guys there were some guys like* trying to fuckin' rob him or some shit but that foo mr chow was like* sending like* back to us so fuckin' mike shot him in the head or foot or some shit ,
EAR_052.xlsx,210,,like* just like* the people that get like* towels and then like* like* ,
EAR_052.xlsx,213,,yeah fuck that i know i was like* hell yeah this is gonna be taken off of i was just dying i was i was like* i wish i was heavy look in the mirror when you're off look like a fuckin crackhead ,
EAR_052.xlsx,230,,i'm faded right now cuz like* fuckin no i'm faded nah i'm pretty sick ,
EAR_052.xlsx,231,,what what the cat yeah bitch yeah today i was going out of like* the parking place like* going out to the ,
EAR_052.xlsx,262,,is the brain game center upstairs is the brain game center upstairs brain game center no it said like* uv suite two oh four yeah brain game center no ,
EAR_052.xlsx,270,,i just smell the candle yeah the candle yeah yeah is it like* fuckin' cinnamon and apple some shit yeah ,
EAR_052.xlsx,277,,like* eighty percent sure well try to fuckin' do conditional add and drop if it if it is because it might be restricted and then you're gonna drop the other one and then you might just lose it yeah well if you're gonna do that might as well click the conditional add and drop ,
EAR_052.xlsx,284,,set what up for you nah they won't troll nah you just gotta ask if they asked for his id and shit when they pulled up yeah but usually they call you when they pull up so like* you gotta have them like* on on speed dial so it could letchu know if they're ,
EAR_052.xlsx,291,,huh he said he said uh nah nah nah nah she said one biological science or molecular cell life and two part class it was like* bio five a bio five a l you had to take that's why i was like* why would you even wanna take that shit yeah ,
EAR_052.xlsx,306,,oliver i texted him and was like* ,
EAR_044.xlsx,3,,it's because i dunno it's like* not that big of a deal like* it's not that big of a problem to me ashley dang ashley acting like she's the most attractive person that no one can deny her like* okay that's fine dude do you wanna find more people to live with us if we do like* two bedroom one bath it's a little cheaper versus like* just one bedroom one bath ,
EAR_044.xlsx,7,,no cuz maybe it's just cuz when you have you been drinking a lot of milk here it's probably cuz your body has to readjust cuz when you stop drinking milk for a while you drink it again all of a sudden your body's just like* what is this yeah yeah you got you gotta readjust to the milk perfect time to wear ,
EAR_044.xlsx,35,,bryan bryan this conversation may be recorded hello yeah so i i for my psych class i have to participate in like* research studies so this is my research study for my class credit and i have to wear this recorder for the next four days and it's gonna record ten percent of my conversations of the day so currently it might be recording right now but it's not gonna catch it's not gonna catch a whole conversation cuz it records every forty seconds so like* it catch yeah ,
EAR_044.xlsx,38,,yeah you can't back out now free t-shirt how do you say free t-shirt in spanish _ did you do like* this thing earlier when for this like* they're all like* we're gonna i'll play you an audio clip but then you're not gonna it's not gonna be english words but we want you to repeat it so it's a bunch of jibberish and i was just like* ok ,
EAR_044.xlsx,41,,come on come on come on come on good have to get to know her better so like* ,
EAR_044.xlsx,57,,is like* tiny oh the uh yeah i'm so for what i'm doing it wouldn't fit me it wouldn't fit me i'm not that much of a quiet person anymore i used to be very quiet no oh my god ,
EAR_044.xlsx,60,,girls seem more like* mhm thank you oh enjoy your food yeah mhm mhm ,
EAR_044.xlsx,64,,neighbors that i talk to you know like* how they talk like* over there and you have alex wait i don't talk to miles or jose in the i don't know who's on my side no i don't talk to the girls next to me yeah well i know it's the girl next to me it's the girl next to me i yea yea i talk to alton a lot ,
EAR_044.xlsx,112,,reaction the calendar who'd actually buy it you see it in the distance right there i don't know i don't think i'd buy it cuz i don't know who they are it's like* for a sorority but who actually from a sorority would buy the calendars though i found this too on the way back from class and one of them was this woman i was like* okay ,
EAR_044.xlsx,114,,you didn't see it on like* on the stairway or anything again huh ,
EAR_044.xlsx,115,,oh i go to the canvas see you guys why not it's for the you know how like* we have to do the research study requirement for psych two huh no it's due by the end of the quarter ,
EAR_044.xlsx,129,,dude today i had my first midterm of the quarter and i was sitting there going like* oh my god how's are how am i already having a midterm this happened so fast cuz last quarter it took forever to get to midterms but this quarter literally i blinked and i'm already taking a midterm i know but yeah but this midterm i thought i did really good and then like* when but i walked my professor before kept telling me it was twenty questions it's gonna be twenty questions on the midterm so i was like* oh ok twenty questions but on when i take the test it was only eighteen questions so i was like* oh he took some off you know but he was just took some off ,
EAR_044.xlsx,131,,the saw you see why ucr was offering a free trip to the getty museum they like* oh we're gonna bus you there and bus you bus and i was like* as it's tuesday tuesday i have no classes right so i was like* oh that sounds pretty cool like* i'd be down to go but then i asked some of my homies if they wanted to come they're like* no i have class i can't make it and i was like* oh okay i was thinking about going but the the the it was like* cuz it sound like a cool thing to go to right but and it's free but the thing is it was from four to eleven pm and i'm like* i don't think i can last that long with only strangers i was like* i'm not i'm not i'm not down to do that yeah but if getty museum ,
EAR_044.xlsx,176,,but yeah he's accepting venmo and i was like* genius his business ,
EAR_044.xlsx,182,,what the one asian hallmate cuz it has a little within my hall it's only like* fifty percent my hallmates i actually talk to and hang out with so within that group there's only the one asian hallmate my roommate and then me who are asian like* the rest are hispanic but there's other asians in the hallway that i talk to but not as much ,
EAR_044.xlsx,195,,why are you going upstairs your polaroids are gonna fall out i was sitting there on new years and i was like* i wanna cut my hair chop chop chop i was sit it was like new years and i was sitting there out on the couch and i was all i wanna cut my hair yeah ,
EAR_044.xlsx,278,,which ones oh did they have hurry up no because i do it with my hallmates like* we have a quiz due at by seven and i do it with my hall yeah it's a psych class yes so we sit in a circle and we do a quiz together and then we have one person take the hit to see what the answers are yeah so i have to go do that today and its my turn today's my turn to take the hit yeah ,
EAR_044.xlsx,280,,but then what was he talking about the staring at the because why would he say that like* ,
EAR_044.xlsx,286,,_ oh you can't go in the back parking lot more because they're building a new resident hall there so you have to go in the front like* the front area you have to go the front horseshoe thingy ,
EAR_044.xlsx,288,,how come we didn't okay but why is we finished one already then how come we don't go for the other ones like* the ones that are are not furnished already oh cuz i'm thinking about falkirk probably oh ,
EAR_044.xlsx,292,,dang she thought how we were doing too good on our quizzes so she's like* she gotta change it up now why'd she do this yeah mhm ,
EAR_044.xlsx,293,,let know so we have to get that all filled out by monday night cuz it's the yeah we all do it separately but then we wait for her to discuss like* what apartment we wanna do and what we're gonna do is kind of like* that's kind of kind of cutting it close okay like* her ,
EAR_044.xlsx,296,,cuz like* cuz i do have the two hundred at home me and jess could cover you if jess is not down to cover you i can cover you cuz ooh that's gonna hurt kinda a lot but i can cover you ,
EAR_044.xlsx,297,,yeah yeah it's like* what if something happened to the team then we're just leaving next year anyways ,
EAR_044.xlsx,298,,yeah monday we have to like* yeah shut up the bitch is coming it's like* somebody is coming turn it down _ why is it why you whispering ,
EAR_044.xlsx,301,,jess will you come play basketball with us or just come to the court and look and like* look like you're with me so i don't look like i'm playing alone cuz someone might steal the court from me like* now now or like* we can go later but now would be good cuz later today i more full yeah cuz i'm like* the only one playing on the court they're gonna see me and be like oh my god you almost done here can we get the court they do that to single people playing ,
EAR_044.xlsx,309,,that's really sad cuz this is i don't i should just text and be like* god can we just give up and do it finals week cuz no one is even online working on it what am i supposed to do ugh what did we pick this one hm i shouldn't have said something back to i don't know what's happening in this class is jess next door with maragrita she sounds like she's next door though ,
EAR_044.xlsx,314,,what are you doing i'm sorry you had to listen to his voice for the past five minutes i know your ears are probably bleeding right now their ears are bleeding i'm so sorry i'm really sorry dude i know like* i'm sorry my homie is so lonely and needs to get a life i'm your ears are currently bleeding i'm pretty sure you get to delete different audio recording don't listen to them later you know what are you doing when's your chem midterm ,
EAR_044.xlsx,316,,yeah it's okay you know you still got your drip you still got your drip you know well the whats you know we the you still got your drip you drippin you drippin to the and they're like* oh man this guy smokes but not today that's drip that's so drip dude don't worry just text her first then ,
EAR_044.xlsx,317,,dude i actually might yeah i might cuz is on tuesday and she was like* having a cla ,
EAR_068.xlsx,4,,look at this she goes uh i'm allergic to apple peaches apricot kiwis shrimp some other stuff but it's okay i'll still eat it she goes the list is honestly too long i have to like* come across it oh yeah that one too on the low apples apricots peaches kiwi kiwi no kiwi is the most kiwi is the big one ,
EAR_068.xlsx,6,,i get a little bro best thing for life i get a good little fuck i was so she was you were outside but yesterday i was telling uh i was telling uh a few days ago i was telling kelly like* kelly was telling me how her favorite chips are turbos right and i'm like* what the hell are turbos and she goes oh it's this ,
EAR_068.xlsx,31,,i'll be there he doesn't his is expired oh you brought a new one alright good oh i'll i'll do it because it's kinda my it's a dream of mine to like* stab someone with an epipen no joke no i want to stab somebody else cuz i'm i'm a lifeguard and then one of the training is to administer an epipen so we have like* ,
EAR_068.xlsx,33,,couple shirts that was so funny why because this morning when i saw nathan he was like* guess who i saw ,
EAR_068.xlsx,47,,and the i was like* i don't know i just wanted to and then and then my dad started making all these gay jokes he was like* you know gay people only wear their earring he was saying to the right of me and then he was like* gay people only wear earrings on their right and i was like* nah i got them both pierced and he was like* nah i can only see the right one i don't know like* they still haven't done anything about my weed i don't know i don't know yeah i tried to play it off as if it was a prank yeah i always mess with my parents ,
EAR_068.xlsx,52,,listen very very carefully chipotle is a cup the parking lot is a cup is the mp3 a cup yes ask kenny why we did this shit to nicole like* twenty minutes playing these stupid minds games ,
EAR_068.xlsx,62,,like* big smoke i forget i forget i'm so sorry you can't breathe than in oh okay yours is bad yeah okay yours is worse than mine then fine if it was another reason then i would slowly convince you to smoke but for this reason no no no i'll stick to buying you edibles i wanna see high kelly later on in the quarter ,
EAR_068.xlsx,65,,some kind of do it give you that kind of volume oh property property you're evicted i mean even if you still have money i like people no no exactly like* people who are rich like nathan he's a very frugal kinda guy ,
EAR_068.xlsx,67,,i don't know what honey walnut shrimp supposed to look like i know it's really popular at like* uh panda express yeah i've heard people get uh allergic to rice yeah no if you're asian that fucking sucks ,
EAR_068.xlsx,128,,here you know how i woke up friday hella early right with nathan so i was like* putting on my shoes and i wore my nmds here and i was just like* why won't they fit and i looked down and they're yours i'm like* why did my shoes just suddenly shrink go go to the back help me move the paddle ,
