Participant,File,Utterance #,Transcript,Coding
EAR_2.xlsx,7,1,ten psychological stress dude look bled to death that's so mean they killed him that mean how do people do that like* ew ,
EAR_2.xlsx,87,,well from what it sounds like _ so what it sounds like i think um you could say like* due to time commitment and um _ my schedule i don't i will not be able to accept my bid um but something along the lines of something like that i just need a clear answer yeah mhm ,
EAR_2.xlsx,124,,really did you say happy bday why remember when my grandpa when everyone visited my grandpa at least three times except yeah no fucking sign of irwin and he was like* what did he say mhm damn even brian every fucking day he would go with us every day brian was there with us ,
EAR_2.xlsx,127,,this is fucking heavy oh my god i almost thought that there was a spider web in this one that she went to mother daughter dance mhmm no she had her earrings on she was like* i went to mother daughter ,
EAR_2.xlsx,206,,peanut butter i don't think we're gonna be able to get out of this what emoji should i put this one and she's like* i guess not what the fuck is that one tube hero ,
EAR_2.xlsx,208,,i feel like* this shits gonna fucking fly out huh ew oh my god hell no that was the fucking worst thing ever ,
EAR_12.xlsx,2,,ugh okay it's like* whatever i think it's like* ,
EAR_12.xlsx,3,,food he needs a freezer okay and then after like* when he eats his food he like* microwaves it and then he doesn't finish and he just ,
EAR_12.xlsx,4,,dude imma send it _ yeah yeah i feel like* this is so mean_ shoot why do i feel so bad ugh ugh fuck i sent it ,
EAR_12.xlsx,5,,so weird what if he picks up oh i thought we had to do that for her cuz my friend had to do that he had to like* record and yeah and it's like* cringeworthy ,
EAR_12.xlsx,7,,oh actually you don't have to go to class right are we late what jason oh ok fuck i feel so bad i didn't even no no i honestly don't like* yeah i don't know why ,
EAR_12.xlsx,22,,about what like the music wait what was going on nothing it was just you know when we were in the room um nick's phone was connected to the tv remember and nick was playing like* romance music wait so what happened between you and hansen no just tell me why does ed like you no wait what happened wait ,
EAR_12.xlsx,23,,there's so many like* the breadth that i need to do yeah ,
EAR_12.xlsx,25,,me and my friend didn't want the hallway we're always scared someone's hiding behind there cuz our housemates like* scaring people like* we prank each other so that's why we don't have that not like* someone's there_ we're out to get you yeah ,
EAR_12.xlsx,29,,cuz like* i was just cuz when he came over and my friend was like* 'dude what the heck like* what're you doing here' he was just like* 'oh i know stamp' he was just like* 'oh yeah i know i see you in class but i just don't say hi' so my friend said that to him and and it just stuck in my head like* you know like* if he's a cool dude and like* you like* see him like* you can say hi right but like* he's just like* 'oh yeah i see you but i just don't say hi' like* he told him that and i'm like* oh okay savage but like* whatever guys just do your thing and then one day like* um finals finals week like* i was just like* okay like* ,
EAR_12.xlsx,31,,i feel like* wait yeah that's how it usually starts off about what oh so she's dating your ex-boyfriend ,
EAR_12.xlsx,35,,yeah get out while you can this year or this quarter and then next quarter it will be fine if you don't have classes together yeah you should still be nice to her but like* don't hangout with her like* pretend you don't need her in your life i think that's like* a like* and if she notices that oh hell yeah ,
EAR_12.xlsx,36,,be like* no just be like* no yeah and then see like* how she reacts did you tell her you were at a friend's house oh okay she asked if she was good yeah do you like music ,
EAR_12.xlsx,37,,dude tomorrow if you guys aren't sure of where you're gonna go eat can you go to raising cane's just like* only if you're not sure cuz i feel so bad i feel like* he's very ,
EAR_12.xlsx,39,,sarah's nice she's very thoughtful but just like* she's moody mhm she's very caring i don't know what she's thinking oh ,
EAR_12.xlsx,42,,todd was like* 'i study better by myself' and then tina was like* 'that's so hurtful' yeah wait didn't someone say he's into this chinese girl now someone not say that that girl wait maybe ed told me but yeah he's like* into this little other girl now little ,
EAR_12.xlsx,54,,i really wanted the main character doctor to get with 's boyfriend i was like mm i was like* they're so cute together no i don't think she is ,
EAR_12.xlsx,65,,well see it depends i don't know that much about north's mythology but like* see it depends like* for example in greek mythology when it came to zeus hades and poseidon they were they chose what they were the gods of yeah it was like* a thing of like* they basically they cast gods or like* three gods and they chose what they were gonna be because of that and then like* ,
EAR_12.xlsx,91,,oh yeah oh_ yeah yeah i honestly did not wanna be at that fundraiser i was just like* i'm so tired and i was like* what after ,
EAR_12.xlsx,92,,huh i'm sorry what did you say uh a line between a and b and all that mhm we should i think we should put a line between every entry so like* a and in b since there's two make a ,
EAR_12.xlsx,101,,none of them are online_ or not that i could find it's okay i'll just ask my friend hopefully she replies no like* just the answers cuz i asked ,
EAR_12.xlsx,102,,no like* i thought about it but i'm just like* that's pretty cool like* that they're gonna be with me until like* senior year like* i don't have to feel sad that they're leaving me who your big who's your big oh that's cool ,
EAR_12.xlsx,118,,he was like* did i do something wrong okay cuz like* we have nothing in common like* it's just really awkward oh okay well andrew is probably telling them because andrew tells everyone everything but he's a good guy we sit in chinese together oh my god ,
EAR_12.xlsx,120,,how does um like* for concentrations in psychology do you have to declare a minor oh okay so can we choose our concentration oh so you came out of bio ,
EAR_12.xlsx,121,,psych two so we can get some experiments it's okay you just bring it with you and every like* twelve minutes or more it records like* forty seconds mhm but don't worry i can go back and like* listen and delete it i was like* thinking about it 'oh shit i totally forgot' forty seconds twelve minutes or more so i don't know when it's recording yeah but like* yesterday we talked for like* three hours ,
EAR_12.xlsx,125,,yeah mhm yeah who grand marc no they don't whatever they probably forgot about it it's kind of annoying now yeah yeah but like* if you decided to go over right you don't even need to change names ,
EAR_12.xlsx,126,,i don't think so like* i feel like* he was trying really hard and i like* ok like* i appreciate that he was trying really hard but like* i kinda want someone that doesn't have to try that hard do you get what i'm saying i don't know like* he's just like me so it's like* yeah like* i'm kinda the one that initiates everything like* i'm so awkward like* why am i initiating stuff ,
EAR_12.xlsx,127,,yeah no like* if he'd totally drop you off and like* oh yeah wait did sarah bring her car this week or what oh okay mm yeah that's so nice ,
EAR_12.xlsx,130,,yeah she goes home she goes home really early like* this friday she left at like* one two maybe monday night like twentieth mhm and they have cars so they can drive ,
EAR_12.xlsx,131,,yeah like* walking up six flights or like* coming down is like* fine but like* going up like* like* the thought of going up six flights of stairs yeah that sucks ,
EAR_12.xlsx,132,,yeah like* we're so done with him like* i was really mad i was like* 'why did you like* go and ruin this like* friendship like* it was pretty strong already cuz we just met like* one two weeks and it was like* i was like* comfortable with him like* raymond took me kind of long like* it took me like* probably like* a month to like* kind of get used to him being around but like* right yeah okay oh okay but me neither until like* this year ,
EAR_12.xlsx,134,,back anyways i don't know no don't wait they like* okay like* i totally hype you up when you show like* yeah i'll stay with you i'll stay with you okay i don't think so but no oh my god ,
EAR_12.xlsx,209,,i'm so glad she decided not to rush or that she had like* event or whatever events oh yeah i'm so freaking glad like* which one yeah i hate it i hate it so much it sucks so much don't update ,
EAR_12.xlsx,211,,yeah yeah did you tell him everything no like* everything about this whole situation yeah okay wait what do they know okay damn ,
EAR_12.xlsx,212,,basically all of like* our entire group um us three victor raymond and then the house except hansen oh no no no no ed shit did i just add you guys in it and also we're doing like* this christmas thing i feel so bad now but like* when we waited we thought about it but then we were just like* oh but like* hansen is getting you something ,
EAR_12.xlsx,217,,aw yeah that one on the left looks pretty decent yeah like* ,
EAR_12.xlsx,227,,oh wait you know when they get boxes like that wait don't you message him on messenger it still doesn't show ohh hmm time to update but i don't like the new update on the iphone don't get it it really sucks really i don't like it okay like* first of all i don't like this thing like* sometimes when you scroll down you kinda like* hit that and then it goes all black and you're just like* where did it go like that ,
EAR_12.xlsx,248,,oh oh yeah i was thinking yeah i don't think that's weird though like* if i were to do that i'd be sobered up ,
EAR_12.xlsx,263,,um i don't think they're gonna have it next quarter because they start at like* twelve or eleven no not well we did last week but i don't know yeah it recorded though ,
EAR_12.xlsx,303,,i was just like* are you sure don't pay wait raymond was there a lot of good bigs was there ,
EAR_12.xlsx,308,,you play basketball dude i really wanna play huh no no i don't know how to play though like* i just wanna play oh i don't know oh really ,
EAR_12.xlsx,313,,go straight and then turn right cuz he was like* i'm scared yeah i think so thank you bye i'll see you uh i don't know tomorrow maybe bye i'm honestly extremely stressed right now ,
EAR_083.xlsx,34,,the milk milk callie i don't think he gives a fuck callie he just sees food no with his nose with his nose like* he can taste woah holy shit that's gonna be a big dog jackson ,
EAR_083.xlsx,36,,damn that's imma just come what do you mean like* no i can sprint like* look i can ,
EAR_083.xlsx,107,,what do you think our family is like* well hold on the side that all of it it seems it seems well i'll tell you i wanna tell you a fun fact don't let this fact get to you for example your grandfather and his brother two people beat up forty people ,
EAR_083.xlsx,140,,no this this one he picked up this week i do mind if i show you he's like* ,
EAR_083.xlsx,298,,it's more acceptable they would look at me as a they would be like* ,
EAR_083.xlsx,302,,i think you're sick _ i think you're sick like* like* cysts the formation of multiple cysts in one common area of the body is highly ,
EAR_083.xlsx,342,,the milk milk callie i don't think he gives a fuck callie he just sees food no with his nose with his nose like* he can taste woah holy shit that's gonna be a big dog jackson ,
EAR_083.xlsx,344,,damn that's imma just come what do you mean like* no i can sprint like* look i can ,
EAR_083.xlsx,415,,what do you think our family is like* well hold on the side that all of it it seems it seems well i'll tell you i wanna tell you a fun fact don't let this fact get to you for example your grandfather and his brother two people beat up forty people ,
EAR_083.xlsx,448,,no this this one he picked up this week i do mind if i show you he's like* ,
EAR_083.xlsx,606,,it's more acceptable they would look at me as a they would be like* ,
EAR_083.xlsx,610,,i think you're sick _ i think you're sick like* like* cysts the formation of multiple cysts in one common area of the body is highly ,
EAR_056.xlsx,3,,so major depression disorder is basically like* a i feel like we all know about it so it's it's basically like* extremely like* depressed and sad they don't really have like* sometimes they can like* sometimes they can't cuz like* the like* the cause of that that is whether it's external or internal and so it's just a person just feels really sad for a long time and i mean what it says here is that it can be like* cured but it also can't so it kind either ,
EAR_056.xlsx,8,,natasha my research i have to do another research thing and so i'm gonna have like* a secret agent that's gonna record me everytime i have a conversation so i just wanna let you know this conversation may be recorded ,
EAR_056.xlsx,54,,oh oh okay thank you thank you oh okay thank you but wait how do you move it all the way down then it does aye no you put okay and then you were like* no nah let's leave it on just in case and i was like* okay ,
EAR_056.xlsx,56,,internet huh huh who who what about me yeah i couldn't do that cuz i'm used to it i can't influence that i can't believe i didn't know how to say fucking uh i was just so mad i was like* ah ,
EAR_056.xlsx,95,,i need to brush my teeth so are really cold does really do you like them that much i like how you share them to me i'm just like* damn that's such a such a phoebe thing to do it's so cute and innocent and dorky where is this where is this ,
EAR_056.xlsx,98,,yeah but like* ,
EAR_056.xlsx,125,,no like* what's up what hap- it's the cheetos no okay then really oh yeah yeah the fish and chips mhm ,
EAR_056.xlsx,126,,can get drunk like* no problem but like* like* he couldn't control like* a different lifestyle yeah out and he's out at parties too that's totally like you though like* i feel like if you had drink if you were to drink you wouldn't do it out in like* a social event you would do it like him as well ,
EAR_056.xlsx,128,,talk to my ra about it and the ra said no like* ,
EAR_056.xlsx,145,,it's like* a research study on i'm the person yeah i can five hundred dollars its like* brain games i tried to find they make it so interesting though why would you reject it ,
EAR_056.xlsx,185,,but i got uh an eighty what the heck if i had known i wouldn't have i would have maybe like* tried a little harder what the heck and so i was just like* oh i might just i thought that i was just gonna be failing the class but in the end i didn't so i was like* oh okay i think i did it i don't know they haven't given me like* my full grade yet and i wanna know what i got in i turned that shit in late but i also you know i don't really wanna talk about it but i wrote about the i love so i hope my passion was seen through those words those really fast words of mine oh shit this is so hard ,
EAR_056.xlsx,231,,what the what the heck i was like* whoo expecting a ,
EAR_056.xlsx,302,,yeah i wore my wig earlier today yesterday i wasn't i wasn't wearing my hoodie while going to the library to finish our homework cuz my laptop wasn't charged so um and i think uh she was there and saw that i had my hoodie on and i was hiding and he was like* why are you wearing your hoodie on and i'm just like* oh i don't like my hair and he was like* well you look comfortable and i was like* thank you oh wait yesterday i was telling paulina cuz i was like* ,
EAR_056.xlsx,306,,waived their prices for new years day to help kick off the new years new years savings plan and to get home safely on the train or bus on new years day they offered to take you to festivities festivities like* _ in grand park downtown or in rainbow harbor in long beach i myself recently went to the chinese new year festivities in chinatown and had a lot of fun it was the first time for my mother to be on the with me and my sister we were teaching her how to navigate my mother was very surprised with how well we learned the streets went to places downtown she was unaware of and how well we knew the names and situations she was proud that we could navigate the city without her help she also liked the amount of cardio we got in that day taking the metro provides a lot of health benefits because ,
EAR_076.xlsx,4,,i like through instagram um argued about you know cigarettes or weed and there is a cigarettes for life and someone was like* you won't have a life you won't have a life with cigarettes this is funny ,
EAR_076.xlsx,42,,another lost another lost building ya'll had hella stuff i said ya'll had hella stuff like* hella buildings no a lot of buildings like* my dad had that one down the street and i have the one in different states and different cities gone gone to lost ,
EAR_076.xlsx,50,,mhm yeah and you gotta click those those present thing again like* this is too much work mhm ,
EAR_076.xlsx,51,,cuz people in in in they don't even have to be sexual like* i was sitting there i remember with she was telling me she was like* but she's like* she was talking about when she was pregnant she was still working in the fields cuz she was there is no like* she was like* people here are very different when i think so ,
EAR_076.xlsx,52,,well it's because of the united states so to say that we have the same verbal weight like* we don't we literally what what mass other than literally white people killing more white people has there been by any people of color no we haven't committed mass genocide but they have so and then i was just like* you know what i i was like* as a black person i was like* i'm just immediately uncomfortable when i'm surrounded in a room with just white people because i always cuz i look different than all of you and they're looking at me and i i'm like* i don't know their experience with black people i don't know if i'm reinforcing ,
EAR_076.xlsx,53,,i don't feel like she's like* the baby i don't get it yeah it's just like* not close to her we always clash on that but that action doesn't make sense for you to do that cuz when she diets she didn't do any research about it and then did research after she got i'm like* what ,
EAR_076.xlsx,56,,i personally like this one no it doesn't that's why two t mom no two t it's small right that's what i thought that's why i thought it would fit her because like* two t and it's not stretchy but it looks but ,
EAR_076.xlsx,69,,have a mental illness that's gonna make him wanna come and shoot the school you know you don't know his history his background how he's raised so to assume that just because you're black and you automatically have some type of immunity and you're just doing it for jokes is dangerous so regardless it's uh it's kind of a like* sad and scary thing cuz if you were doing it for clout you just fucked up your whole life and if you yeah cuz i mean i feel like* that's what most serial killers do they want their names out there they want some attention ,
EAR_076.xlsx,106,,yeah like* actually said that you didn't invite him he said that you guys didn't invite him so he wasn't going to come which was like* my mom was like* just come very dramatic_oh hi i know ,
EAR_076.xlsx,110,,and then her mom started with the it's not over here there's nothing we're gonna be in the mountains i was like* oh my goodness why are you guys both so dramatic yeah ,
EAR_076.xlsx,120,,like* ending the party i was like* why is she saying that ,
EAR_076.xlsx,137,,yeah we can you wanna change it to the yeah you should tie it like* tie it around with the thingy ,
EAR_076.xlsx,141,,mhm i didn't tell you what happened so i was driving and remember what you alway i always remember what you taught me like* when a car stops next to you don't go no matter what like* if it stopped but i was i was at the front right the light turned green and i started to go and the person next to me is not going so i slowed down cuz i'm like* what like* there a stop but it could've been like* yeah people are usually on their phone so i stopped and it's ,
EAR_076.xlsx,142,,the chairs cuz we can't decorate the tables if we don't know what it looks like that doesn't he was like* oh and then everyone just looked at carlos and he was like* oh well yeah i guess i guess no we didn't have class mhm because we set the tables up and they wanted to put more space and i was like* you don't need that much space whatever yeah ,
EAR_076.xlsx,197,,yeah okay not all day we can move we can move some of that stuff into your car i just need my clothes and like* a tooth brush and whatever so it's not like we're taking everything back huh ,
EAR_076.xlsx,201,,that looks like* max i think two-hundred yeah huh mhm financial aid um they give you an estimate it will probably be in loans what do you mean two we just get our calgrant ,
EAR_076.xlsx,202,,like you but they pay so little to be a corporation i'm like nine dollars ten something yeah and i was like* huh maybe this is not updated ,
EAR_076.xlsx,204,,do we have its really good but it's like* more expensive turkey's good ,
EAR_076.xlsx,208,,you mean like* the fence that he made he hasn't changed ,
EAR_076.xlsx,222,,and that was our mother's day oh my grandpa fell today that was horrifying my car door was open and we have like* this lil thing that he has right and well i don't know what instead of closing my car door to walk to the stairway like* to walk to me he tried to climb over the stairway yeah i get no we'll try right here is anyone coming in please don't hit my car is that reverse yes windows go down go in ,
EAR_076.xlsx,223,,right there argh and then today we both got up late _ and went to and then wendys we tried to go to a resturant they were full and i was like* give up we give up we went down boston market which has like* has chicken they didn't even have any chicken ready yeah mm i was like* i don't want turkey we tried to get at sizzlers we were in that line for ten minutes and had not even made it to the register to sit down ,
EAR_076.xlsx,234,,you should have been like* tough yeah cuz target wants you to free everyday that's what my cousin who used to work she like* if you wanna get a job at target you have to put that you're available anytime i told you don't apply to target and you're like* mhm we don't know no mhm nah ,
EAR_076.xlsx,236,,i'm telling you taxes makes a difference you took a lot because the thing is like* once you work they you're paying into your social security already you're paying into which which depends on maybe your medical might be you know that's what i'm saying like* it could or could not be depending on how they do that if you if i had my w-twos oh might or might check i could give you a better thing i don't really remember if i paid into the medic i think i think we do i think we pay into ,
EAR_076.xlsx,237,,of you know like* i'm like* if real issues not that's not an issue that's just you don't like it they feel like the walls were tacky color i don't you know what i'm saying like* stuff like that i'm always like* mm you think the parking spaces are too small mm no shit like that where really petty and i'm like* that was unhelpful who cares so i was that's how i look at the reviews i'm like* is there actually an issue or are you gonna make it a issue cuz i don't care enough ,
EAR_076.xlsx,266,,it's the same you know i'm saying same with tyler she doesn't care about the struggle she's going through her no you know i was gonna i almost said something i looked at nancy are you gonna say something cuz i'm like* this is not my kid they're just my cousins but i mean they're my cousins that i'm like* the closests to and uh yeah i thought nancy was going to say something i'm like* they're not my kids and i you know i was like* you know i was like* i just grabbed the kids and i went in ,
EAR_076.xlsx,267,,of course they they're i'm telling you they feel empowered because everyone is so um afraid i didn't know that that's ridiculous actually what are they going to do they're not in charge of anything but if let's them let's them be in charge of things like* no if you act like that you shouldn't be in the kitchen doesn't matter ,
EAR_076.xlsx,272,,i guess i guess i saw it because i i at some point it was i don't know i saw it somewhere i think when she first put in there was like* a mistake and so i was yeah i saw it it was like* a mistake where instead of um it being your test score it was like* the amount of points that the the exam was worth so it was flipped and it was we were gonna get like* a over a blank amount of percent of of it was like* it was like* one-twenty-three over like* ,
EAR_076.xlsx,305,,oh my ex _ i was just like* to take a break going off and i was just like* oh my goodness i was just saying like* its stupid i'm like* if you really cared about the community you would get them a present you know its just annoying because we made exception for one person but then let anyone know you know didn't let their exes so i was like* i was mad i'm like* i'm just doing it cu a lot of people like him and the thing is like* everyone who's advocating for him to be prez were were all ,
EAR_076.xlsx,309,,us yeah yeah but cuz i was gonna say like* the i know we did like* a lot of things you could do for us and make but i don't know if you could have it like* with my mom she's do when i'd be like* nauseous and stuff is to you take a um some olive oil and you like* pretty much take a whole garlic sautee it so it leaks into the oil and you scoop up the oil and you drink it ,
EAR_076.xlsx,310,,you haven't what oh how long have you the last time you got what am i trying to say um how long have you been working like* there mm uh the fuck ,
