Participant,File,Utterance #,Transcript,Coding
EAR_053.xlsx,130,,if you guys stay i'll be here if you guys leave then i'll make fuck i'm going to cabana later i'm going to cabana to play smash bros cuz i don't wanna go anywhere bro like* yeah but you have to take him this is your pseudo little damn bro ,
EAR_053.xlsx,196,,so hot like* yeah i know mm i'm so lucky no you can tell her all the way down i have to filter some stuff no i have nothing to hide it's just like* more embarrassing than um like* actually something to hide you know what i mean ,
EAR_053.xlsx,199,,i mean like* roughly that's good yeah i took it because you were leaving without it ,
EAR_053.xlsx,275,,yeah i don't know i would've but he's kind of a kind of a to be honest uh i'm pretty sure gabe picked him up yeah cuz like* gabe was like* third on his list and i was like* first and then fuckin' ben told me decide on it i was like* yeah i don't wanna pick him up but i know gabe really wants to pick him up so hit him up nah caleb he would smoke he would smoke wide awake you want some ,
EAR_073.xlsx,87,,oh yes so he bald uh okay he's like* fuck it what's tomorrow uh oh dude my back's hurt it hurts so bad and like* i'm taking a dance class we don't do dance we just do yoga for a little time and like* i thought that would help but it's not and it feels way worse and then yesterday i was putting on my sweater and it popped something popped bro and i was crying i was on the floor ,
EAR_073.xlsx,199,,check if they flipped like* you sure okay cuz last time it flipped ,
EAR_065.xlsx,9,,i was i just left the psych study thing and now i'm going um go talk hello hello hello can you hear me can you hear me um i sorry i was in the psych like* study thing but now going to um what the fuck was ,
EAR_065.xlsx,17,,i think like* eight or nine months so this is the phone that fucking i literally rec can record me this conversation may be recorded it could've but it's only forty second increments and it's every twelve minutes forty seconds she told me it's about four sentences ,
EAR_065.xlsx,23,,well just text me oh yeah yeah i haven't seen him once this year dude i like seeing people around you know like* from our hall joda ,
EAR_065.xlsx,45,,i have so much pi phi shit too oh shit sorry ah yeah i guess no i told her i was like* i have a birthday dinner today ,
EAR_065.xlsx,84,,well i mean yeah well i mean not him trying to get back at bebe but i think he just was probably feeling the other girl's name is gigi um and and so um he was like* venting to me and i was just like* whoa you didn't really tell her like* your feelings so it's not like* she really knows either and like* blah blah blah and he's like* yeah you're right and then i don't know oh yeah he is he and then i guess he actually i'm going to look at his story i guess he post ,
EAR_065.xlsx,133,,fine not like* white ,
EAR_065.xlsx,140,,these are like* old-ass people like* look ,
EAR_065.xlsx,198,,i'm not dumb i'm done taking care of you i don't wanna hear from your mom or anything and from anyone else to like* keep watching over you like* you figure it out on your own and i was like* just i was like* you don't have to what as long as you tell kiwi like* do you need me here and if she says no then you won't have to stay there you can go have fun but if she the second she asks for your help you have to be there and then yeah but i don't know if sonya knows that she lost her phone again but then she found it huh ,
EAR_065.xlsx,203,,i'm telling you going home is not the i'm telling you going home doesn't do shit honestly like* now because i'm just my classes are harder too so it's harder for me to actually go there ,
EAR_065.xlsx,253,,kkk what you don't want me to i asked her i was like* i know like* there's rumors that like* you can't get pregnant after and like* i don't know if it's healthy for me cuz like* having a regular period is like* reassuring and stuff and she's like* well she's like* everything's healthy like* um because we're putting hormones in your body that don't make you get your period so it's healthy like* you're all like* everything's good you can still have kids afterwards that doesn't affect it like* if you can't have kids then you just can't have kids it's not from that um so ,
EAR_065.xlsx,263,,no well the thing's that i went to the bank whatever it's called and they said that um it takes they're gonna start processing it around june that's when like* the files june yeah so we don't know until june ,
EAR_065.xlsx,287,,i'll be selling them separately but he said four hundred for both so like* you'd be paying so like* if anything have your big i mean even then you guys split it a hundred each like* chris right now one day tickets are selling starting one-fifty well i can see but the thing is i mean either way you would go you would pay like* do the transaction through paypal because paypal always secures scams so like* you'd that ,
EAR_065.xlsx,288,,well either way she's gonna be able to find out like* has records _ everyone is looking for sunday passes i'm gonna fuckin' check my phone _ guys look for tickets looking for sunday pass sunday how much would you be willing to offer ,
EAR_065.xlsx,289,,i feel like if people know that i got the ticket and gave it to you they're gonna well i mean you can tell them if they get mad they can kiss my ass but like* she said i hate you find mine i'm trying bitch i been trying the fuck um if you want ,
EAR_21.xlsx,9,,i don't know yeah to work yeah it's like* ,
EAR_21.xlsx,13,,i could pay it's like* two for one but he didn't tell you he's like* when he's about to pay he just whips it out yeah it's two for one would you judge him would you be like* do i want him to he used a coupon ,
EAR_21.xlsx,34,,she like* ,
EAR_21.xlsx,35,,fresh waters what're those refills i want one that i want a specific kind there's this one where it's like* ,
EAR_21.xlsx,41,,applied math applied math it's like* ,
EAR_21.xlsx,49,,this is the raf one so look at this one have you seen like* ,
EAR_21.xlsx,58,,you're so you're so i can't believe it the shit you told her he fucking beat the shit out of she's probably gonna come wanna come straight away like* ,
EAR_21.xlsx,64,,look at my stomach all this fucking food i need to shit no don't you ever get like* ,
EAR_21.xlsx,82,,when you said you made like* ,
EAR_21.xlsx,84,,my family always offers me like* ,
EAR_21.xlsx,91,,is whack like* ,
EAR_21.xlsx,129,,eat first do one thing and then move on she's like* ,
EAR_21.xlsx,139,,feels better yeah but they're not like* ,
EAR_21.xlsx,146,,that's cool did you help him cuz he always put like* ,
EAR_21.xlsx,185,,yeah our main sport like* ,
EAR_21.xlsx,190,,yeah ah ah ah fine i'll clean that out like* ,
EAR_049.xlsx,15,,is it small what is it aw how many tattoos do you have how many tattoos do you have that's the only one i swear i thought you had something like* ,
EAR_049.xlsx,16,,hurry huh i know you know when you first said it i was like* throw it back it felt it sounded correct but at the same time i was like* wait a second you know you know what i'm saying you get it ,
EAR_049.xlsx,19,,what maybe it's a sign yeah they are be like* you're a normal boy you're the normal stereotype what are they gonna think ,
EAR_049.xlsx,22,,they're lucky i never stop at so it's fine watch them blow up my face like* right outside wanted not allowed banned from the store no it's it's only if you have that coupon hey whatever we get it ,
EAR_049.xlsx,138,,yeah i know but at least we can probably but someone go i don't wanna go by myself this is a codependent relationship you guys have going just check in on your school every time she passes by just in and then like* low ,
EAR_049.xlsx,139,,what is that called yeah yeah it's like* a game plan oh smart cool ,
EAR_049.xlsx,144,,like* i don't know yeah yeah yeah like* no but like* they report like* forty seconds so it doesn't really like* capture your conversation with anyone like* they'll just extract like* a sentence like* maybe us and the more you get the exactly yeah uh huh ,
EAR_049.xlsx,146,,like* it's worth the money like* you can get it at like* go fund me ,
EAR_049.xlsx,147,,in there chilling and i was like* wait a second could've just it's fine we don't really need it the happy birthday ,
EAR_049.xlsx,148,,box for trump would you theoretically just like* check in anywhere and stuff like* oh proximity you can't just um go to like* a restaurant in hawaii and just checking in you know i tried doing that so like* yeah but i normally ,
EAR_049.xlsx,149,,oh okay whatever it's okay it's right there i parked it close it's okay yeah what are you gonna like* walk walk it out anyways it's not that bad damn there's a bird that all over that car over there you see the like* the switch ,
EAR_049.xlsx,151,,she gets out at nine yeah she's like* where's she at she's in irvine already she's at her house yeah no i'm fine if you wanna go we can go who's at that kick back that you know ,
EAR_049.xlsx,152,,so what if like* there's guys just giving you attention but you're not like* or anything like* you don't want it like that uh huh oh mm mm not even agc what's that ,
EAR_049.xlsx,153,,he's so cute i thought he was too and i was like* but i saw his i found his tinder i was like* wow take it now ,
EAR_049.xlsx,314,,oh yeah when do you when do you start working okay so like* during summer i could do that recommend me ,
EAR_049.xlsx,315,,cry and i'll do it how do you like* where's the lighter what ,
EAR_049.xlsx,321,,oh my god if man sung like that like* me i'd cry ,
EAR_054.xlsx,8,,who else is acting right now that so annoying uh ha ha ha _ come on hurry the fuck up okay what tickets do we want a three yeah we need to write those numbers like* a four and c three right ,
EAR_054.xlsx,13,,uh it just says please try again later we could not process every single ticket _ like* i'm pretty sure there's tickets but it's like* not letting me buy shit see _ ugh but see all of them keep coming back ,
EAR_054.xlsx,17,,no honestly the thing i don't really like them that much it's just barely i like them ok you barely started liking them i feel like* yeah how much is the ticket now oh that's not bad that's actually a pretty good deal but i think it's better that you like* ,
EAR_054.xlsx,33,,yeah we who like* records this shit like* literally just pull your phone out oh don't you use your back isn't that dangerous oh i was talking about your back in the videos ,
EAR_054.xlsx,58,,so funny you're just watching me i was like* she's so cute and you looked so confused that's so funny he was so confused why i like* honked the horn and i was like* it's arena one time we were making out in the car and i like* accidentally like* horn ,
EAR_054.xlsx,59,,right at eleven thirty i know right wanna see something arena hit it from the back oh yeah my shit's recording they're gonna be like* from the back who ,
EAR_054.xlsx,62,,i remember that day that someone won in san jose that last year it was october no it was september and i like* told my mom i'm gonna win the lottery that day and ,
EAR_054.xlsx,64,,yeah that's okay you fell in love or what you're just like* this dude ,
EAR_054.xlsx,66,,look they gave me this pin i have to wear it because i have no i they like* gave me a microphone that i have to wear for the study and i literally saw they literally gave me the pin i was like* i have to wear that whenever i go out with it imagine imagine talking to someone wearing that you what the fuck are you doing oh did i just drop something oh ,
EAR_054.xlsx,71,,he like* ended the call ah okay i don't think she wants to talk to me rahat she ended the call okay i'm gonna take these off i need your opinion on my outfit duh do i look like a whore ,
EAR_054.xlsx,146,,whatcha doin' oh i was like* i'm bored uhuh ,
EAR_054.xlsx,153,,i dunno why _ like* why am i sleepy who am i i was like* sleeping early too and i was like* but that's like* not bad me like* the fact that i wouldn't have woken up unless i heard you open the door unless i didn't even hear you open the door cuz i only opened woke up because you opened ,
EAR_054.xlsx,154,,just do it girl they do we look at hot guys we jack off we suck our dicks uh what what do you just we just laugh a lot we just joke around make fun of people from our sorority _ like* ,
EAR_054.xlsx,155,,yeah so you said you _ had to get starbucks and you could nap for like* ten minutes while there if you keep acting like a dumbass like a fucking child i'm literally gonna smack your fucking face you're pissing me the fuck off because you're pissing me off no you're so annoying okay i'll be right back but the laptop will still be on but i'm gonna go get fucking starbucks why are you acting like a psychotic child oh don't blame your sleep ,
EAR_042.xlsx,9,,she's gonna get into usc dude i told her like* who's gonna provide for you like* your mom is not gonna _ yes dude like* i was like* you're so dumb like* but i didn't wanna and like* when she told me ucla i was like* abby you just went from uh you you're dropping from a uc to go to another uc like* i know dude i i told her like* abby i got waitlisted ,
EAR_042.xlsx,16,,and then you burn it and that's cool i won't buy another hoodie jacob just dropped another hoodie no um the one i bought is like* um a face clan hoodie so like* a gamer like* a gaming clan you know those fortnite videos i watch i'll show you i don't know how to do that i do but aaron doesn't know how and it's frustrating cuz i know nick but ,
EAR_042.xlsx,17,,sends it at seven pm i know it's like* no and then i finished my other quizzes and i was gonna do that shit like* tonight like* today cuz i had time and i saw and it was like* open at seven pm and i was like* bitch nah i'll still play fortnite i'm gonna do my physics homework right now at five at twelve but i mean you could but nah but then you gotta for wake up early to go and you don't like waking up early mhm ,
EAR_042.xlsx,18,,can i change it man we're already in anaheim where oh i was like* nigga what i was like* ,
EAR_042.xlsx,21,,that's the same thing no that one's the same thing excuse me _ still not sleeping what the fudge i don't even like* ,
EAR_042.xlsx,24,,ah she's not gonna go huh you wanna go she i know she was like* i'll maybe go nah i told her straight up no you know what i'm saying yeah you already pay one thirty ,
EAR_042.xlsx,40,,oh my god cynthia look how i won like* i wanna show you this is so you don't know how i won like* it was so crazy i'm getting good at the game now huh oh i'm so hyped ,
EAR_042.xlsx,84,,alright you wanna play the teams one cuz that one wasn't the team one yeah like* you're gonna do everything don't even be like* frankie help me frankie help me cuz guess what when you say frankie help me guess what imma do imma play the entire game oh tickle tickle tickle here stay right here don't do anything ,
EAR_042.xlsx,86,,fortnite she can do obstacle courses ugh sure mom no yeah with teeth or like* with it ,
EAR_042.xlsx,107,,no hm he has other priorities i have her number the security guard's because she i don't know yeah i don't know but i blocked her so no she doesn't but i just blocked her it was the first day cuz i was like* i don't wanna fucking talk to her if she ever tries to call me ,
EAR_042.xlsx,167,,why do you go all the way around dude why don't you like* over there oh my god ,
EAR_042.xlsx,197,,no no i don't like spending too much times with kids you're like* yeah thanks for telling me now _ yeah cuz when you have a kid you have to like* you have take like* full attention to them and that's like* more money yeah then she's not the one for me cuz ,
EAR_042.xlsx,202,,you wanna stay here while i get the car well you have stay out no yeah okay for sure oh my god okay i know hey wait okay imma get the car then cuz the like* i know can we ,
EAR_042.xlsx,238,,is it the one with the nike air or the jordan brand no but like* in the front you know the tag it it the nike air or the jordan oh yeah cuz i don't like those fucking jordan logo oh shit i was like* what the fuck ,
EAR_042.xlsx,239,,what i don't know i don't got jordans super no i been getting vans nigga it's not like jordans are really there's like* one jordan that i fuck like* i really want but it's fucking expensive ,
EAR_042.xlsx,270,,it's like* fuck ,
EAR_081.xlsx,56,,i i had an interview also yeah i had it i had it on friday at at nine in the morning or eight i think it was at eight it was aight it was cool it was like* a group interview and then it was only me and this one girl and then that girl that was interviewing me like* she she didn't have any any experience around here huh uh yeah i'm coming next week they're going they're going to group well yeah but i i don't really think that matters cuz like* people hire like* people without experience all the time ,
EAR_081.xlsx,66,,but like* who who just some random ass food or what funny why you have a small head close the bag they're gonna get crusty like your head mhm oh look at this this video's funny look at this look at chef boy gizmo i know you don't have this video ,
EAR_081.xlsx,68,,it's the fuckin' the engine thing look that shit look that's the band is under it and i was driving like that that's that happened a day before cuz the next day he drove drained better back to the car mhm yeah and he left it over there what grandma told me i was like* shit two cars already like* broke down or something i was like* yeah mine actually broke down i heard it's probably just bad yeah ,
EAR_081.xlsx,83,,woah woah woah woah woah i told you really need to tomorrow she's like* you think i'm stupid cecilia you're going to chick-fil-a tomorrow she says she ,
EAR_081.xlsx,84,,what though uh no because allergies alright i swear to god you were drinking huh oh my god where'd you guys go it was like* a what was it ,
EAR_081.xlsx,86,,well hopefully shit i hope so bro i was thinking like* like* when you were applying i was like* bro why you could just start a new just start a new but i was like* whole lot a scrolling yes the fuck what do you mean oh ,
EAR_039.xlsx,1,,but not as prepared as everybody else so i'd rather take it like* confidently and what i always feel like is when i take a test weeks later i feel like i shoulda taken it then you know so that's why i want to do that with this when i cuz now i'm actually given the opportunity next week but what's cool is that um so we're given options for the our final we can either write two essays ugh right who the hell wants to write two essays or participate in research so today i participated in research from eight to nine um ,
EAR_039.xlsx,2,,and like* i was like* well_ what yeah she_she loved her man i love her though cuz she funny so_ she's like my spirit woman i i was sitting in the back when i came that time because i was late yeah yeah i was sitting next to savannah that time like* recently in class i sat next to her the other times like* i always come later sometimes yeah yeah and we can all sit together yeah that's what she needed what row is that ,
EAR_039.xlsx,13,,what is this about okay is it okay if i already did that can i just like* put more ideas down maybe okay cool okay cool yeah okay i'll go ahead and do all that is this step one okay oh okay cool thank you um i'll get this what thank you ,
EAR_039.xlsx,19,,yeah i was just gonna say that um she is a teacher up at uc santa cruz so sometimes she does host a lot of events where you know outside students are able to go to literally see her in person and it's like having like* you said like* a martin luther king in pre you know in our present day so we should take advantage um and yeah just you know maybe look online she if she'll have any events and go check it out because she definitely is still a monumental figure for the the the black movement right exactly she's an important figure ,
EAR_039.xlsx,23,,was that the law that also kind of like* allowed there to be public lynching and stuff like that lynching like* that was like* a_right that's part of it okay but of_of course like* different state to state but majority like* that was mm mhm ,
EAR_039.xlsx,27,,for real then you know you going to be compared for the rest of your life damn my parents would disown me at that point like* they wouldn't_ they got the_they got a daughter like* who am i the the guest i just live there and take their money nah just because of the fact that mom be comparing me to strangers god forbid someone within the family oh my god no it's crazy i was telling her that back in the days like* my friend's brother got honor roll why can't ,
EAR_039.xlsx,28,,you never know you never really know yeah i want that so badly i really just like* god damn and then i don't know_i was talking to one and he's great or whatever ,
EAR_039.xlsx,29,,real life yeah i did it myself that's why so i should yeah i'm gonna do gel because that was a really cute set though yeah let me see you know what i wanna get the bandana the red bandana on my nails with um and it says like* words or like* a written and stuff but you know like that that one font i can't describe it but like* that oh my god that kind of looks like this other one i wanted to get uhm that ethiopian girl helen did it ,
EAR_039.xlsx,30,,that's hella random where did_is she wearing like* a shirt that says that that's hella random they don't know you they only know the bad kids ,
EAR_039.xlsx,32,,cuz in order for me to get the four_the units in my class my psychology class i'm supposed to either two essays or participate in research like this so uh i'm doing research like this and i found one where i was getting paid so i was like* uh i gave them my email and information i said let me help you i'm a psychology major i would like* if i have participants let me be the participant like* i got you here's my email my number and my name like* take it off and call me please uh it shuts it shuts its twenty-four seven basically until sunday eleven fifty-nine pm no for three days or four days yeah ,
EAR_039.xlsx,33,,again why would you ever sing like that that shit don't exist so what how is that a though you're_that's the opposite of that yeah that's the thing bruh bitch you know how i like* i'm just_i'm like* what's it called like* open minded whatever i don't know like* it don't matter to me cuz i be doing the same thing like* if i i don't think twice when that shit happens if i'm granted and i was granted to fuck two people in one week i'm gonna do that not to mention the other the dicks i'm sucking but no fucking hello ,
EAR_039.xlsx,36,,oh who was there um what's your leader called well not leader but like* what's mhm ivan right and that's president okay so he's the girl's president really you can have a president that doesn't go to your school nice that's nice and you guys like* do you know who they are and are close to them why would you miss that ,
EAR_039.xlsx,37,,it so that's why i was like* oh my god i had to say something because that like* paired up with exactly what the fuck i was going through with her um but yeah we like* she really wants to be friends with me though she really was like* you're like* the first person i met and like* i really respect you and i don't want you to like* feel us any type of way but like* you know i and mean blah blah blah like* she really was just like* tryna still me like* have like* according to her like* we're probably close friends i don't know like* i hope she doesn't think we're close friends but she thinks we're definitely friends uh but thing is i'm not ever finna text her to hang out um at least i'll hit her up in like* 3 months and see how her view is you know around then people change ,
EAR_039.xlsx,38,,she's a teacher at santa cruz and she has she hosts a lot of events like* y'all need to hit her up because she's our modern-day martin luther king she's here in the present day form like* if you don't take advantage of that we're so selfish if i know someone in the future it gon be like* me but then other people are gon miss that like* opportunity ,
EAR_039.xlsx,53,,yeah compton like* inglewood venice san santa monica but those are all cities ,
EAR_039.xlsx,66,,it's behind us yeah basically like* we're on that road again like* we're not on that nice freeway ,
EAR_039.xlsx,99,,there you are yeah i'm so i'm gonna _i might leave like* after coming home i after coming home you know oh so i was saying like* i'm craving a so i know we're leaving tomorrow but i wanna eat as much as possible so i sit today oh you do okay good ,
EAR_039.xlsx,104,,or no after the i was tryna order from that because i was finally twenty-one so girl so it don't matter but then like* the buy one get one free they used to i used to get a buy one get one free that means if i bought a i got free if i bought a eighth i got an eighth free okay and i and then they twenty five dollars now it says that it's forty dollars for buy one get one free but i'm still like* okay buy one get one free forty that's not too bad but it twenty five's still if i got if i had a card you know what i mean cuz that's why uh they really they're catering for right now that's fine because even the people you have that don't really need it and then the people who don't ,
EAR_039.xlsx,106,,nah chelsea hella a real one because josh is the one who wanted to go to the beach and she drove_to the beach like* isn't that crazy let me find it oh shit i don't know how to use this_this shit oh fuck oh fucking fuck how do i do this what do i do where do i go where do i go where the fuck do i go what the hell is this what the fuck is that oh hell no ,
